video_id,judul,channel,tanggal_tayang,deskripsi,views,likes,komentar,url,keyword
pgmncdRflcE,Seri Webinar Nasional: Bersama Menciptakan Kampus yang Aman dari Kekerasan Seksual_UINAM,Rumata Artspace,2021-12-10 20:49:42,,57,5,0,https://www.youtube.com/watch?v=pgmncdRflcE,sexual harassment kampus indonesia
WR1YH-LCRk4,16 Mahasiswa FH UI Terjerat Kasus Pelecehan Seksual,Kompascom Nusantara,2026-04-15 05:00:35,Sebanyak 16 orang mahasiswa Universitas Indonesia (UI) diduga melakukan pelecehan terhadap mahasiswi di fakultas tersebut.,56,0,0,https://www.youtube.com/watch?v=WR1YH-LCRk4,sexual harassment kampus indonesia
QL6Ew4Typwg,Video Sosialisasi Pencegahan Dan Penanganan Kekerasan Seksual (PPKS) di Perguruan Tinggi,Universitas Nurdin Hamzah,2025-01-10 12:49:25,,53,0,3,https://www.youtube.com/watch?v=QL6Ew4Typwg,PPKS perguruan tinggi
TBxoFcfOUuM,"Mahasiswi ULM Curhat, Mengaku Alami Dugaan Pelecehan Oleh Oknum Dosen",KOMPASTV BANJARMASIN,2023-02-03 22:08:08,,49,0,0,https://www.youtube.com/watch?v=TBxoFcfOUuM,kekerasan seksual dosen mahasiswa
g9OPY1Lpboo,[SATGAS PPKS STIE PPI] Apa Ya Yang Harus Kita Lakukan Apabila Mengalami Kekerasan Seksual?,INSTITUT PPI,2024-06-25 03:40:10,SATGAS PPKS merupakan Satuan Tugas Pencegahan dan Penanganan Kekerasan Seksual atau yang disebut dengan Satgas ...,48,3,0,https://www.youtube.com/watch?v=g9OPY1Lpboo,PPKS perguruan tinggi
JcK4F52L59g,PODCAST INSPIRATIF: Peran Satgas PPKS Dalam Mencegah Dan Menangani Kekerasan Seksual Di Kampus,FISIP PERADABAN OFFICIAL,2025-02-01 05:54:12,"Kekerasan seksual di perguruan tinggi adalah isu yang tidak boleh diabaikan. Dalam episode kali ini, kami berbincang dengan ...",48,4,0,https://www.youtube.com/watch?v=JcK4F52L59g,PPKS perguruan tinggi
HfTbMfK0aRg,"Cegah Kekerasan Seksual di Lingkungan Kampus, Unej Mulai Siapkan Anggota Satgas PPKS",Tribun Jatim Timur,2022-11-29 11:54:53,,48,0,0,https://www.youtube.com/watch?v=HfTbMfK0aRg,satgas PPKS kampus
E0wtgjk_cwA,Uji Publik Calon Satgas Pencegahan dan Penangananan Kekerasan Seksual di Perguruan Tinggi PPKS STIKE,STIKESMAS ABDI NUSA PALEMBANG,2024-08-26 06:25:14,,46,0,0,https://www.youtube.com/watch?v=E0wtgjk_cwA,PPKS perguruan tinggi
YT7kYqVahxo,Satgas Pencegahan dan Penanganan Kekerasan Seksua (PPKS) Itera,Itera TV,2025-03-17 06:23:01,Kenali Satgas PPKS ITERA! Satgas Pencegahan dan Penanganan Kekerasan Seksual (PPKS) ITERA hadir untuk menciptakan ...,42,2,0,https://www.youtube.com/watch?v=YT7kYqVahxo,PPKS perguruan tinggi
3jecec2YBw4,SATGAS PPKS UB DETEKSI GUNUNG ES TINDAK PERUNDUNGAN DAN KEKERASAN SEKSUAL - NEWS POINT,UBTV BRAWIJAYA,2024-07-26 09:00:07,UNIVERSITAS BRAWIJAYA TELEVISI (UBTV) 43 UHF Channel Malang Raya Televisi Komunitas Perguruan Tinggi Indonesia ...,42,0,0,https://www.youtube.com/watch?v=3jecec2YBw4,PPKS perguruan tinggi
m6o9sZvOcig,Lawan Pelecehan Seksual di Kampus (bagian 2),KOMPASTV PALEMBANG,2021-12-09 11:48:38,"Sahabat Kompas TV Palembang, jangan lupa like, comment, dan subscribe channel YouTube Kompas TV Palembang, juga ...",41,0,0,https://www.youtube.com/watch?v=m6o9sZvOcig,kekerasan seksual kampus
Q03jtYUxMrs,Sosialisasi Satgas PPKS 20 Maret 2024,SATGAS PPKS UNIVERSITAS GALUH,2024-04-05 03:09:38,Sosialisasi Satgas PPKS Universitas Galuh 20 Maret 2024.,40,1,0,https://www.youtube.com/watch?v=Q03jtYUxMrs,PPKS perguruan tinggi
2PwhYXpJWEg,Satgas PPKS UKI Toraja Gencar Sosialisasikan Pencegahan Kekerasan Seksual di Lingkungan Kampus,TRIBUN TORAJA OFFICIAL,2024-08-24 08:25:00,"tribuntoraja #beritatoraja TRIBUNTORAJA.COM - Universitas Kristen Indonesia (UKI) Toraja, Sulawesi Selatan, berkomitmen ...",39,1,0,https://www.youtube.com/watch?v=2PwhYXpJWEg,satgas PPKS kampus
6bhDj8obZ8k,Rektor IPB Buka Suara Soal 16 Mahasiswa Lakukan Kekerasan Seksual: Mereka Diskorsing Satu Semester,Pikiran Rakyat,2026-04-24 13:26:13,Sebanyak 16 mahasiswa Institut Pertanian Bogor (IPB University) resmi menjalani sanksi skorsing selama satu semester setelah ...,38,1,0,https://www.youtube.com/watch?v=6bhDj8obZ8k,pelecehan seksual mahasiswa
JG-OO_SEtLc,Untag Surabaya Bentuk Satgas PPKS Untuk Jauhkan Kekerasan Seksual Terhadap Warga Kampus,LenteraTV Media,2022-06-21 06:39:23,,37,0,0,https://www.youtube.com/watch?v=JG-OO_SEtLc,satgas PPKS kampus
t2OK_rGsOkk,PPKS: Webinar Pencegahan dan Penanganan Kekerasan Seksual (PPKS) di Lingkungan Universitas OSO,Universitas OSO,2022-06-13 08:06:24,Universitas OSO melakukan sosialisasi daring tentang pencegahan dan penanganan kekerasan seksual di lingkungan kampus ...,37,1,0,https://www.youtube.com/watch?v=t2OK_rGsOkk,PPKS perguruan tinggi
EltsWAC2zvo,Ketua Satgas PPKS Unmul Sebut Kasus Kekerasan Seksual tertinggi terjadi pada Perguruan Tinggi,Insitekaltim,2024-03-12 06:23:15,Ketua Satgas PPKS Unmul Sebut Kasus Kekerasan Seksual tertinggi terjadi pada Perguruan Tinggi berdasarkan Hasil Penelitian ...,32,1,0,https://www.youtube.com/watch?v=EltsWAC2zvo,PPKS perguruan tinggi
To0MBcnANXc,GERPUAN UNJ: Kawal Implementrasi Permendikbudristek: Dorong Pembentukan Satgas PPKS di Kampus!,Gerpuan UNJ,2021-12-05 12:03:06,Terbitnya Permendikbudristek Nomor 30 Tahun 2021 mengenai PPKS memantik berbagai kasus kekerasan seksual terungkap ...,32,7,0,https://www.youtube.com/watch?v=To0MBcnANXc,satgas PPKS kampus
_eCl6AuEoXM,Profil Satgas PPKS UNRI serta Dukungan penuh dari Rektor serta Pimpinan Universitas Riau,Satgas PPKS Universitas Riau,2024-04-06 08:18:07,dukungan penuh dari Rektor dan Pimpinan Universitas Riau untuk mencegah kekerasan seksual di lingkungan Universitas Riau.,32,1,0,https://www.youtube.com/watch?v=_eCl6AuEoXM,PPKS perguruan tinggi
jn0vQ0We6KE,PENGENALAN SATGAS PPKS KAMPUS PPNP,K-INFO NEWS PPNP,2025-08-23 10:30:42,,30,1,0,https://www.youtube.com/watch?v=jn0vQ0We6KE,satgas PPKS kampus
EV8qAa80W7M,ABKIN Dorong Mahasiswa Cegah Kekerasan dan Pelecehan di Kampus,News PONTV,2025-08-02 11:18:14,Pengurus Daerah Asosiasi Bimbingan dan Konseling Indonesia (ABKIN) Kalimantan Barat menggelar dialog interaktif dengan ...,24,1,0,https://www.youtube.com/watch?v=EV8qAa80W7M,sexual harassment kampus indonesia
6tgeVbnNBos,"Darurat Kekerasan Seksual Di Lingkungan Kampus, Saatnya Bersuara dan Berani Untuk Menangkalnya",Salsabila Putri,2024-05-24 05:40:34,"Kami dari kelompok 3 Mata Kuliah Komunikasi & Advokasi Kebijakan Kelas 2022B Prodi Ilmu Administrasi Negara, dengan ...",23,1,0,https://www.youtube.com/watch?v=6tgeVbnNBos,korban kekerasan seksual kampus
5YbEVwJf_CI,"Antisipasi 3 Dosa Pendidikan, DWP USU Sosialisasi PPKS",USU TV Official,2023-10-18 02:34:29,Dharma Wanita Persatuan (DWP) Universitas Sumatera Utara (USU) gelar sosialisasi Pencegahan dan Penanganan Kekerasan ...,21,0,0,https://www.youtube.com/watch?v=5YbEVwJf_CI,PPKS perguruan tinggi
ZdEeAQ6WlnM,Video Kekerasan Seksual Di Perguruan  Tinggi #ppks,Ketut Sriyanti,2023-09-02 07:14:58,Halo semuanya... Assalamualaikum Wr. Wb.. Shalom..Om swastyastu namo buddhaya salam kebajikan.. Saya Ketut Sriyanti ...,17,0,0,https://www.youtube.com/watch?v=ZdEeAQ6WlnM,PPKS perguruan tinggi
3pNElXRZutk,SATGAS KEKERASAN SEKSUAL DI KAMPUS,BALI SRUTI,2023-10-09 11:53:28,Di Universitas Udayana sudah ada SATGAS kekerasan seksual lho. Bagaimana dikampus kalian? Kekerasan seksual berpotensi ...,17,0,0,https://www.youtube.com/watch?v=3pNElXRZutk,satgas PPKS kampus
9fhtEMmMvtE,Pencegahan dan Penanganan Kekerasan Seksual (PPKS) Dilingkungan Perguruan Tinggi,Mukhammad Syaoqon ,2023-09-01 12:16:14,Mari kita semua berkontribusi untuk menciptakan perubahan positif dan memastikan bahwa setiap mahasiswa merasa aman dan ...,15,0,0,https://www.youtube.com/watch?v=9fhtEMmMvtE,PPKS perguruan tinggi
N_jE5JEhF2A,KAMPUS DIWAJIBKAN MILIKI SATGAS PPKS,PAL TV Official,2024-06-08 12:33:15,"LIPUTANMETROPOLISPALTV #PALEMBANG #NEWS Subscribe, comment dan share videonya serta klik tombol lonceng untuk ...",13,3,0,https://www.youtube.com/watch?v=N_jE5JEhF2A,satgas PPKS kampus
LwgVKASmzQk,"Penanganan, pencegahan, pelecehan seksual kampus unesa",security Indonesia channel,2026-04-16 22:43:20,satpam #satuankeamanan #keamanan #professional #handling #handlingcomplaint #petugaskeamanan #keamananprofesional ...,11,2,0,https://www.youtube.com/watch?v=LwgVKASmzQk,sexual harassment kampus indonesia
06-5TKGGa7M,Pentingnya PPKS Di Lingkungan Perguruan Tinggi,Cinta NKRI,2021-11-18 04:25:22,,11,2,0,https://www.youtube.com/watch?v=06-5TKGGa7M,PPKS perguruan tinggi
xHOAxL3hHxI,Calon Anggota #SATGASppks Pencegahan dan Penanganan Kekerasan Seksual PPKS di Perguruan Tinggi,Johana B Tumbol,2023-11-08 07:29:18,Video singkat Satgas PPKS di Perguruan Tinggi.,7,0,0,https://www.youtube.com/watch?v=xHOAxL3hHxI,PPKS perguruan tinggi
lJtYwN_ykNU,Pencegahan dan Penanganan Kekerasan Seksual (PPKS) di lingkungan Perguruan Tinggi.,Kristian Imanuel,2023-09-03 14:16:44,Pencegahan dan Penanganan Kekerasan Seksual (PPKS) di lingkungan Perguruan Tinggi sebagai bagian dari kampanye PPKS ...,6,0,0,https://www.youtube.com/watch?v=lJtYwN_ykNU,PPKS perguruan tinggi
htOB56ceWuM,Uji Publik Calon Satgas Pencegahan dan Penangananan Kekerasan Seksual di Perguruan Tinggi PPKS STIKE,STIKESMAS ABDI NUSA PALEMBANG,2024-08-26 06:23:34,,5,1,0,https://www.youtube.com/watch?v=htOB56ceWuM,PPKS perguruan tinggi
