video_id,judul,channel,tanggal_tayang,deskripsi,views,likes,komentar,url,keyword
sjMBoXzn8aU,Pelaku Pelecehan Seksual di Universitas Gunadarma Dipersekusi Jadi Sorotan Kemen PPPA | Liputan 6,Liputan6,2022-12-17 01:39:56,Aksi persekusi yang terjadi di Universitas Gunadarma mendapat perhatian dari Kementerian PPPA. Mereka menilai kendati ...,701,3,3,https://www.youtube.com/watch?v=sjMBoXzn8aU,kasus pelecehan seksual universitas
KjfIunEeHfQ,Mewujudkan Kampus Bebas Kekerasan Seksual: Pentingnya Satgas PPKS di Perguruan Tinggi!,"Kementerian Pendidikan Tinggi, Sains dan Teknologi",2025-02-18 05:49:01,,684,7,0,https://www.youtube.com/watch?v=KjfIunEeHfQ,PPKS perguruan tinggi
S4_Z8ODGwFk,Mahasiswa Unsoed yang Dianiaya Rekan Dilaporkan ke Polisi Soal Kekerasan Seksual,kumparan,2026-04-23 07:13:22,"Seorang mahasiswa Universitas Jenderal Soedirman (Unsoed), Purwokerto, Banyumas, Jawa Tengah, berinisial D melapor ke ...",671,3,2,https://www.youtube.com/watch?v=S4_Z8ODGwFk,pelecehan seksual mahasiswa
Xswkcw1slzs,SATGAS PPKS USU Periode 2022-2024,Universitas Sumatera Utara,2022-09-07 12:05:12,www.usu.ac.id.,638,23,2,https://www.youtube.com/watch?v=Xswkcw1slzs,PPKS perguruan tinggi
zCYM3MVTpDc,Momen 2 Mahasiswa Klarifikasi Kasus Dugaan Pelecehan Seksual di UI,KOMPASTV SORONG,2026-04-14 10:17:55,"JAKARTA, KOMPAS.TV - Selasa (14/4/2026) dini hari, auditorium Universitas Indonesia dipenuhi mahasiswa yang ingin meminta ...",630,4,0,https://www.youtube.com/watch?v=zCYM3MVTpDc,pelecehan seksual mahasiswa
aEHLpsE2C8U,Satgas PPKS Universitas Budi Luhur 2022,Nada Luhur SWYC,2022-08-30 03:40:00,"Universitas Budi Luhur telah membentuk pansel, satgas, dan duta Anti Kekerasan seksual loh. Terdapat beberapa rangkaian ...",595,136,17,https://www.youtube.com/watch?v=aEHLpsE2C8U,satgas PPKS kampus
fTDE7-B5bqA,"3 Mahasiswi UMY Jadi Korban Kekerasan Seksual, Pelaku Dikeluarkan dari Kampus | Liputan 6",Liputan6,2022-01-07 08:01:51,Kekerasan seksual terjadi lagi di lingkungan kampus. Tiga mahasiswi disebut menjadi korban pemerkosaan oleh seorang aktivis ...,582,14,0,https://www.youtube.com/watch?v=fTDE7-B5bqA,kekerasan seksual kampus
fb0SRastwGg,"Kasus Pelecehan di FH UI, Rieke: Jangan Hanya Disanksi Administratif!",Banteng Senayan,2026-04-22 09:28:47,Kemarahan publik terhadap maraknya kasus kekerasan seksual di lingkungan kampus kembali mencuat. Rieke Diah Pitaloka ...,572,5,0,https://www.youtube.com/watch?v=fb0SRastwGg,sexual harassment kampus indonesia
s8ORr48Fwaw,Sosialisasi Satgas PPKS di Perguruan Tinggi,LLDIKTI Wilayah VI,2023-05-19 21:09:29,,559,2,1,https://www.youtube.com/watch?v=s8ORr48Fwaw,PPKS perguruan tinggi
wadkJo8wG3Q,Kampus Investigasi Dugaan Pelecehan Seksual Mahasiswa FH UI,KOMPASTV JAWA TENGAH,2026-04-14 07:51:21,KOMPAS.TV - Kampus Investigasi Dugaan Pelecehan Seksual Mahasiswa FH UI #beritaterkini #ui #mahasiswa #polisi Sahabat ...,558,2,0,https://www.youtube.com/watch?v=wadkJo8wG3Q,sexual harassment kampus indonesia
d57VImR50wQ,"Banyak Frasa Multiinterpretasi, Permendikbud PPKS Dianggap Sulit Dijalankan, Akademisi: Harus Revisi",Tribunnews,2021-12-11 08:46:40,TRIBUN-VIDEO.COM - Permendikbud PPKS masih menjadi kontroversi hingga kini. Peraturan untuk payung hukum bagi ...,553,0,0,https://www.youtube.com/watch?v=d57VImR50wQ,PPKS perguruan tinggi
xhtkwugpL5k,"Yakin Cuma Bercanda, Bukan Pelecehan? Ini Tata Cara Lapor ke Satgas PPKS ITS!",Institut Teknologi Sepuluh Nopember,2026-04-14 05:01:01,"Trivday, program panduan praktis dari ITS TV, hadir untuk memberikan berbagai tips, trik, hingga serba-serbi unik seputar ...",548,64,0,https://www.youtube.com/watch?v=xhtkwugpL5k,satgas PPKS kampus
O_g8CCNnyUw,"🔴 Trijaya Live | CHAT PELECEHAN MAHASISWA UI, ALARM PENDIDIKAN TINGGI INDONESIA | Hot Topik Pagi",Trijaya FM,2026-04-15 16:04:17,Universitas Indonesia (UI) melakukan investigasi kasus dugaan pelecehan seksual secara verbal yang melibatkan belasan ...,545,4,0,https://www.youtube.com/watch?v=O_g8CCNnyUw,sexual harassment kampus indonesia
ZxgwDip7e7o,Penyebab Kekerasan Seksual Marak Terjadi di Kampus,medcom id,2021-11-27 05:07:30,Kasus kekerasan seksual yang terjadi di lingkungan perguruan tinggi kian mencuat. Satu demi satu terungkap kasus yang terjadi ...,539,5,2,https://www.youtube.com/watch?v=ZxgwDip7e7o,kekerasan seksual kampus
mJOSkhBy5SM,"🔴LIVE: Diduga Dilecehkan Dosen, Mahasiswi Unima Depresi hingga Ditemukan Meninggal di Kamar Kos",Tribun Gorontalo,2026-01-01 20:42:52,"LIVE: Diduga Dilecehkan Dosen, Mahasiswi Unima Depresi hingga Ditemukan Meninggal di Kamar Kos VP : Rinaldy Remon ...",509,2,1,https://www.youtube.com/watch?v=mJOSkhBy5SM,kekerasan seksual dosen mahasiswa
0k_V_NUkiE8,Pembentukan Satgas PPKS: Langkah UI Wujudkan Kampus Aman dari Kekerasan Seksual,Televisi UI,2022-10-10 11:30:00,"Sebagai langkah mewujudkan kampus aman dari kekerasan seksual, Universitas Indonesia membentuk Satuan Tugas ...",499,21,1,https://www.youtube.com/watch?v=0k_V_NUkiE8,satgas PPKS kampus
05agOCxVljI,UI Nonaktifkan 16 Mahasiswa FH Terduga Pelaku Pelecehan Seksual,Diskursus Net,2026-04-16 09:30:20,Universitas Indonesia mengambil langkah tegas dengan menonaktifkan 16 mahasiswa Fakultas Hukum yang diduga terlibat ...,488,3,2,https://www.youtube.com/watch?v=05agOCxVljI,sexual harassment kampus indonesia
R709b0MEj-g,🗨️ CAKRALOKA &quot;Satgas Pencegahan dan Penanganan Kekerasan Seksual UM&quot; 📅 29 Agustus 2022 - 15.00 WIB,Universitas Negeri Malang Official,2022-08-29 04:05:17,"https://youtu.be/7wG7w32Yqqc Satgas Pencegahan dan Penanganan Kekerasan Seksual UM Narasumber : Desinta Dwi Rapita, ...",472,13,0,https://www.youtube.com/watch?v=R709b0MEj-g,satgas PPKS kampus
SoYG_pTUjoI,"TERIAKAN DO MENGGEMA di Sidang Terbuka Kasus Pelecehan Seksual FH UI, Kampus Siapkan Sanksi Tegas",Tribunnews Depok,2026-04-14 11:17:06,"Download aplikasi berita TribunX di Play Store atau App Store untuk dapatkan pengalaman baru WARTAKOTALIVECOM, Jakarta ...",451,4,0,https://www.youtube.com/watch?v=SoYG_pTUjoI,kasus pelecehan seksual universitas
x1Z7yUsIPy8,"Kunjungan Satgas PPKS Binus University ke Rifka Annisa; stop kekerasan, wujudkan kampus aman!😍✨",Rifka Annisa,2025-04-17 10:42:01,,449,2,0,https://www.youtube.com/watch?v=x1Z7yUsIPy8,satgas PPKS kampus
bQzUZsSln9w,Sosiolog: Permendikbud Payungi Hukum Korban Kekerasan Seksual di Kampus #iNewsSiang 22/11,Official iNews,2021-11-22 08:51:37,Tanggal Tayang: 22/11/2021 Dapatkan sajian berita-berita liputan langsung dari lapangan dan peristiwa terkini secara cepat dan ...,428,6,0,https://www.youtube.com/watch?v=bQzUZsSln9w,sexual harassment kampus indonesia
MmZ8bTj3Kkw,"🔴NYARIS RICUH DI FH UI, 16 MAHASISWA Anggota Grup Chat di Fakultas Hukum Dipamerkan",TribunMadura Official,2026-04-14 11:12:26,Download aplikasi berita TribunX di Play Store atau App Store untuk dapatkan pengalaman baru TRIBUN-VIDEO.,424,0,0,https://www.youtube.com/watch?v=MmZ8bTj3Kkw,kasus pelecehan seksual universitas
rz2uBJd3EQg,Jadi Korban kekerasan Seksual? Adukan! | REDAKSI PAGI (11/12/21),REDAKSI TRANS7 OFFICIAL,2021-12-12 06:00:29,,410,7,0,https://www.youtube.com/watch?v=rz2uBJd3EQg,korban kekerasan seksual kampus
_4jNvEbUn_E,Darurat Pelecehan S*ksual: Mengapa Kampus Jadi “Sarang Predator”?,Podcast Senin Sore,2026-04-20 09:00:06,"Sobat Sore, Mengapa institusi pendidikan yang seharusnya menjadi tempat paling aman, justru menempati urutan pertama kasus ...",403,7,0,https://www.youtube.com/watch?v=_4jNvEbUn_E,korban kekerasan seksual kampus
NxbOJzc1DYk,Dosen Unesa Diduga Lakukan Pelecehan ke Mahasiswa,KOMPASTV JAWA TIMUR,2022-01-11 05:26:17,"Surabaya, KompasTV Jawa Timur - Humas Universitas Negeri Surabaya Vinda Maya menyebut bahwa hingga saat ini jumlah ...",402,2,2,https://www.youtube.com/watch?v=NxbOJzc1DYk,kekerasan seksual dosen mahasiswa
wHKNeoclpSY,"Tak Hanya Mahasiswi, 16 Mahasiswa UI Juga Targetkan Dosen Jadi Bahan Pelecehan",TRIBUN LAMPUNG NEWS VIDEO,2026-04-14 15:50:11,"Tak Hanya Mahasiswi, 16 Mahasiswa UI Juga Targetkan Dosen Jadi Bahan Pelecehan Tak hanya menyasar mahasiswi, ke-16 ...",399,7,3,https://www.youtube.com/watch?v=wHKNeoclpSY,kekerasan seksual dosen mahasiswa
AnhKWoyecfU,Dosen Pelaku Pelecehan Seksual Mahasiswi Bergelar Doktor dan Sudah Menikah 2 Kali,Tribun Padang Official,2022-12-24 07:44:51,TRIBUN-VIDEO.COM - Oknum dosen Fakultas Ilmu Budaya (FIB) Universitas Andalas (Unand) pelaku pelecehan seksual ...,375,3,0,https://www.youtube.com/watch?v=AnhKWoyecfU,kekerasan seksual dosen mahasiswa
IqiITXUP3lc,Seri Edukasi Permen PPKS: Pencegahan Kekerasan Seksual di Lingkungan Kampus,Cerdas Berkarakter Kemendikdasmen RI,2021-10-28 11:47:59,Permendikbudristek Nomor 30 Tahun 2021 tentang Pencegahan dan Penanganan Kekerasan Seksual di Lingkungan Perguruan ...,365,6,0,https://www.youtube.com/watch?v=IqiITXUP3lc,PPKS perguruan tinggi
cFHjnlaVMYk,Urgensi Pencegahan dan Penanganan Kekerasan Seksual di Perguruan Tinggi,FH Undip Official,2022-04-11 09:33:08,,357,15,0,https://www.youtube.com/watch?v=cFHjnlaVMYk,PPKS perguruan tinggi
MdBuT618Q3c,Ramai Kasus Pelecehan Seksual di Kampus | Fokus,Fokus Indosiar,2026-04-17 00:00:25,"Kasus dugaan pelecehan seksual oleh belasan mahasiswa Universitas Indonesia terus disorot, dan Polda Metro Jaya ...",346,5,0,https://www.youtube.com/watch?v=MdBuT618Q3c,korban kekerasan seksual kampus
9sMOr4hgQCY,Klarifikasi Tangkapan Layar Grup Chat terkait  Kasus Dugaan Pelecehan Seksual di UI,KOMPASTV GORONTALO,2026-04-15 05:42:21,"JAKARTA, KOMPAS.TV - Selasa (14/4/2026) dini hari, auditorium Universitas Indonesia dipenuhi mahasiswa yang ingin meminta ...",340,2,1,https://www.youtube.com/watch?v=9sMOr4hgQCY,sexual harassment kampus indonesia
ARFwZwh8EVo,Chronology of Universitas Indonesia’s Law Faculty (FHUI) Students Sexual Harassment Case #news #FHUI,laudya s,2026-04-16 12:40:22,fullnya tonton di video terkait.,337,23,5,https://www.youtube.com/watch?v=ARFwZwh8EVo,sexual harassment kampus indonesia
wrS2ot5IXok,"Tegas! IPB Skors 16 Mahasiswa Pelaku Pelecehan Seksual, Rektor: Tidak Ada Toleransi bagi Pelaku!",GARUDA TV,2026-04-21 05:51:56,GarudaTV - Kampus bukan tempat bagi pelaku kekerasan seksual! ⚖️ Institut Pertanian Bogor (IPB) mengambil langkah ...,315,2,0,https://www.youtube.com/watch?v=wrS2ot5IXok,pelecehan seksual mahasiswa
6v6ZcoOFne8,Elva Qolbina : 8 Bulan Satgas PPKS UI Kerja Tanpa Anggaran dan Ruangan,Partai Solidaritas Indonesia,2023-08-01 09:40:42,"Kekerasan Seksual nggak bisa dipandang sebelah mata. Dalam hal ini, Kami percaya bahwa Satgas PPKS UI adalah garda ...",295,11,3,https://www.youtube.com/watch?v=6v6ZcoOFne8,PPKS perguruan tinggi
fMuBgwLkSTo,Kuliah Umum &quot;Menuju Kampus Bebas Kekerasan Seksual&quot;,Sastra Inggris USD Official,2022-02-07 17:42:03,,294,19,0,https://www.youtube.com/watch?v=fMuBgwLkSTo,korban kekerasan seksual kampus
tfcmknfKKRA,Sosialisasi SATGAS PPKS di Kampus AKN Pacitan,Akademi Komunitas Negeri Pacitan,2023-03-24 05:16:02,,290,10,0,https://www.youtube.com/watch?v=tfcmknfKKRA,PPKS perguruan tinggi
vv0RDIcxT_Y,"[ESTE-VOICE] TERINDIKASI CACAT PROSEDUR, BAGAIMANA TANGGAPAN MAHASISWA MENGENAI SATGAS PPKS UNM?",Estetika Pers,2023-04-01 00:28:28,Salam Pers Mahasiswa! ✊ Hai hai Sahabat Estetika     UNM telah mengambil langkah yang tepat dengan membentuk Satgas ...,288,41,0,https://www.youtube.com/watch?v=vv0RDIcxT_Y,satgas PPKS kampus
EBLHrmJVFSo,Komisi X DPR RI - Sorot Maraknya Kekerasan Seksual di Kampus - TVR 120,TVR PARLEMEN,2026-04-21 09:36:02,Kasus kekerasan seksual di perguruan tinggi kian mengkhawatirkan. DPR RI mendesak penanganan tegas agar kampus ...,284,0,0,https://www.youtube.com/watch?v=EBLHrmJVFSo,kekerasan seksual kampus
2cSKPjDok5g,PODCAST NGGIH EPS 4 - PERAN SATGAS PPKS: SEBAGAI PELINDUNG KASUS KEKERASAN SEKSUAL DI KAMPUS,UKI TV,2024-05-26 05:18:44,Halo Sobat Singgih!! Video part 2 kali ini masih membahas tentang Urgensi Pencegahan dan Penanganan Kekerasan Seksual di ...,272,12,0,https://www.youtube.com/watch?v=2cSKPjDok5g,PPKS perguruan tinggi
RYUlG1eI5-E,"6 Fakta Kasus Pelecehan Seksual 16 Mahasiswa FH UI yang Jadi Sorotan Publik, Bermula dari Grup Chat",Tribun Mataraman,2026-04-14 09:36:02,Download aplikasi berita TribunX di Play Store atau App Store untuk dapatkan pengalaman baru Host : Septyana Eka VP : Reza ...,272,2,0,https://www.youtube.com/watch?v=RYUlG1eI5-E,pelecehan seksual mahasiswa
v9flTPl-mW4,Kasus Dugaan Pelecehan di Kampus Harus Ditindak Tegas,RRI JAKARTA,2026-04-14 04:06:37,"Dugaan kasus pelecehan seksual di lingkungan kampus kembali menjadi sorotan publik. Dian Kartika Sari menegaskan, jika ...",270,2,0,https://www.youtube.com/watch?v=v9flTPl-mW4,sexual harassment kampus indonesia
Gf7bctEFmVU,Sosialisasi Pencegahan dan Penanganan Kekerasan Seksual (PPKS),Fakultas MIPA UNS,2023-01-11 03:28:26,,266,6,0,https://www.youtube.com/watch?v=Gf7bctEFmVU,PPKS perguruan tinggi
406eEG0r7eI,"Cegah Kekerasan Seksual, Zero Tolerance! | Satgas PPKS Unika Atma Jaya",Universitas Katolik Indonesia Atma Jaya,2023-10-12 03:55:21,,263,5,0,https://www.youtube.com/watch?v=406eEG0r7eI,satgas PPKS kampus
LH3USn2T-gs,Satgas PPKS Sosialisasikan Pemberantasan Kekerasan Seksual di Kampus | UNAIR Update,UNAIRTV,2023-10-05 06:00:07,Satuan Tugas (Satgas) Pencegahan dan Penanganan Kekerasan Seksual (PPKS) UNAIR baru saja menggelar sosialisasi pada ...,258,6,0,https://www.youtube.com/watch?v=LH3USn2T-gs,PPKS perguruan tinggi
T3hnAngdW8s,Kasus Pelecehan Seksual Unesa,Transmedia Jawa Timur,2022-01-12 20:19:52,"Humas Universitas Negeri Surabaya, Menyatakan Pihaknya Akan Mengawal Kasus Dugaan Pelecehan Seksual Yang Menimpa ...",246,2,0,https://www.youtube.com/watch?v=T3hnAngdW8s,kasus pelecehan seksual universitas
IGA9QkWr2vg,"6 Fakta Kasus Pelecehan Seksual 16 Mahasiswa FH UI yang Jadi Sorotan Publik, Bermula dari Grup Chat",TribunMadura Official,2026-04-14 09:35:43,Download aplikasi berita TribunX di Play Store atau App Store untuk dapatkan pengalaman baru Host : Septyana Eka VP : Reza ...,237,2,0,https://www.youtube.com/watch?v=IGA9QkWr2vg,pelecehan seksual mahasiswa
hATkCH1y2zk,5 Mahasiswa Jadi Korban Pelecehan Pegawai Kampus,KOMPASTV JAWA TENGAH,2023-02-17 05:40:43,"SEMARANG, KOMPAS.TV - Pihak Universitas Ikip Veteran (Unisvet) Kota Semarang, Jawa Tengah, membenarkan bahwa ...",204,2,0,https://www.youtube.com/watch?v=hATkCH1y2zk,korban kekerasan seksual kampus
Tzx34SvycB4,Eps. 25 - SATGAS PPKS PENS : Ruang Aman Korban Kekerasan Seksual Kampus?!,Siniar PENS,2025-02-12 11:30:21,"Halohai SiniAre! Udah tau belom nih kalau di PENS ada satgas PPKS, dimana kalian bisa curhat tentang masalah yang ada ...",200,4,0,https://www.youtube.com/watch?v=Tzx34SvycB4,satgas PPKS kampus
oAy9yaxwFwE,Profil Satgas PPKS (Penanganan dan Pencegahan Kekerasan Seksual) Universitas Semarang,HUMAS USM,2023-10-27 08:26:59,,197,4,0,https://www.youtube.com/watch?v=oAy9yaxwFwE,satgas PPKS kampus
50KB3bTU89I,KAMPUS ZONA AMAN? | A-CDM Podcast Ep. 1  x BEM Faperta UNEJ ft. Satgas PPKS,Agribusiness Creative Digital Media,2024-11-22 11:10:35,[FAPERTA ON AIR] Hidup Mahasiswa! Hidup Pertanian Indonesia! Hallo Waperta! Kali ini BEM FAPERTA mengadakan Podcast ...,193,19,2,https://www.youtube.com/watch?v=50KB3bTU89I,satgas PPKS kampus
hA6xNPpIeUA,Speak Up! Let’s Stop Sexual Violence on Campus,atamerica,2022-10-26 09:07:36,Cases of sexual assault on university campuses have increased globally and across Indonesia. What steps has Indonesia taken ...,192,0,0,https://www.youtube.com/watch?v=hA6xNPpIeUA,sexual harassment kampus indonesia
xkfvmdoyW1I,Konsinyasi Pimpinan PTS dan Satgas PPKS Menuju Kampus Zero Dari Kekerasan Seksual,Mercu TV Official,2024-07-17 05:29:05,Auditorium Gd. Tower Lt.7 Universitas Mercu Buana #mercubuana #mercutv #lldikti3 #fikomumb #febumb #fdskumb ...,191,11,0,https://www.youtube.com/watch?v=xkfvmdoyW1I,satgas PPKS kampus
kQ81_xJgRac,Rapat Pembentukan Satgas PPKD USTJ 2024,Satgas PPKPT USTJ Papua,2024-10-27 05:03:47,Rapat yang dilakukan untuk membentuk Satgas Pencegahan dan Penanganan Kekerasan Seksual di Lingkungan Kampus USTJ ...,188,48,0,https://www.youtube.com/watch?v=kQ81_xJgRac,satgas PPKS kampus
RpBaJqkUM9s,"🔴16 Mahasiswa FH UI Diduga Lakukan Pelecehan Seksual, Aliansi BEM UI Desak Kampus Segera Bertindak",Tribun Banten,2026-04-15 15:38:27,Video Production : Sirajuddin Abbas #tribunbanten.,172,2,0,https://www.youtube.com/watch?v=RpBaJqkUM9s,pelecehan seksual mahasiswa
y30WbtOcj1Y,SEBERAPA PENTINGNYA SATGAS PPKS DI KAMPUS ??,AYU EFRITADEWI,2023-04-25 15:14:17,"Mari kita dengarkan penjelasan ketua satgas ppks umrah cand. Dr. Nikodemus Niko, S.Sos., M.Sos.",171,11,0,https://www.youtube.com/watch?v=y30WbtOcj1Y,satgas PPKS kampus
MFJmyOd-wmE,Dosen Pelaku Pelecehan Seksual Terhadap Mahasiswi Ditetapkan Tersangka,BeritaSatu,2023-05-09 05:35:43,Satreskrim Polres Buleleng Bali menetapkan seorang dosen salah satu perguruan tinggi sebagai tersangka dugaan pelecehan ...,170,2,1,https://www.youtube.com/watch?v=MFJmyOd-wmE,kekerasan seksual dosen mahasiswa
-2k94e3qhf8,Rektor Universitas Pancasila Dinonaktifkan Buntut Kasus Pelecehan Seksual | Ragam Perkara Siang,Investigasi tvOne,2024-02-28 04:18:42,"Ragam Perkara Siang, https://www.tvOnenews.com - Rektor Universitas Pancasila Dinonaktifkan Buntut Kasus Pelecehan ...",169,1,2,https://www.youtube.com/watch?v=-2k94e3qhf8,kasus pelecehan seksual universitas
rFOeABCUVtg,SOSIALISASI SATGAS PPKS DI LINGKUNGAN FK UNRI,fkunri official,2023-09-13 05:36:10,SOSIALISASI SATGAS PPKS DI LINGKUNGAN FK UNRI - 12 SEPTEMBER 2023.,169,1,0,https://www.youtube.com/watch?v=rFOeABCUVtg,satgas PPKS kampus
wldIRDMPDrY,Urgensi Pengadaan Lembaga Perlindungan Korban Kekerasan Seksual di Perguruan Tinggi,Perempuan Berkisah,2021-09-04 20:43:06,"Komunitas Perempuan Berkisah Region Jawa Timur Proudly present : Dialog Interaktif dengan tema ""Urgensi Pengadaan ...",155,11,0,https://www.youtube.com/watch?v=wldIRDMPDrY,korban kekerasan seksual kampus
hBRHq75P4J4,Ini 6 Poin Tuntutan Mahasiswa Unpatti Menyoal Kasus Kekerasan Seksual Oknum Dosen,TribunAmbon News,2024-04-24 09:19:38,"OA,Laporan Wartawan TribunAmbon.com, Maula Pellu AMBON, TRIBUNAMBON.COM - Mahasiswa Unpatti kembali menyoroti ...",154,2,0,https://www.youtube.com/watch?v=hBRHq75P4J4,kekerasan seksual dosen mahasiswa
VItyCbob8EI,Kekerasan Seksual di Kampus,Sosiologi Channel,2022-01-05 06:47:43,kekerasanseksual #pelecehanseksual.,151,7,0,https://www.youtube.com/watch?v=VItyCbob8EI,korban kekerasan seksual kampus
-4HjlTXh62E,"June 7, 2024 Seleksi Wawancara Satgas PPKS IPNG",Nusantara Global,2024-06-07 06:35:28,ipng #satgas #ppks #kampusmerdeka #pansel.,148,6,0,https://www.youtube.com/watch?v=-4HjlTXh62E,satgas PPKS kampus
e8_sV9Qcg5M,Pendapat Feni Rose Terkait Pelecehan Seksual di Antara Mahasiswa,Insertlive,2026-04-23 10:00:00,Feni Rose sangat khawatir dengan pelecehan seksual yang terjadi di lingkungan belajar. Terlebih di kalangan mahasiswa yang ...,146,4,0,https://www.youtube.com/watch?v=e8_sV9Qcg5M,pelecehan seksual mahasiswa
VdI7ljxkz3o,Kekerasan Seksual Yang Terjadi Di Lingkungan Kampus (PODCAST SERI 1),CLC FH UNUD,2021-11-21 00:46:13,Kekerasan Seksual Yang Terjadi Di Lingkungan Kampus (PODCAST SERI 1),146,8,0,https://www.youtube.com/watch?v=VdI7ljxkz3o,korban kekerasan seksual kampus
vlDsT19wl80,Sosialisasi PPKS Bersama Mahasiswa Baru - SATGAS PPKS UNIVERSITAS PEKALONGAN,universitas pekalongan,2023-12-10 01:45:54,Sosialisasi PPKS Bersama Mahasiswa Baru Mencegah Kekerasan Seksual Menuju Kampus Unikal Sehat dan Aman - SATGAS ...,138,0,0,https://www.youtube.com/watch?v=vlDsT19wl80,satgas PPKS kampus
bthgoSkUSTc,Video Profile Satgas PPKS UKI,OFFICIAL UKI JAKARTA,2025-02-11 07:37:50,"Hallo sobat UKI. We are here! Satgas PPKS UKI telah hadir. Kekerasan seksual dapat terjadi di mana pun, termasuk kampus.",133,4,0,https://www.youtube.com/watch?v=bthgoSkUSTc,satgas PPKS kampus
DBdW6wEmd7g,Guru Besar Unpad Dinonaktifkan Dugaan Pelecehan Seksual #shorts,KOMPASTV JAWA BARAT,2026-04-22 08:49:23,"gurubesar #unpad #pelecehanseksual BANDUNG, KOMPAS.TV - Viral seorang guru besar Fakultas Keperawatan di Universitas ...",127,1,0,https://www.youtube.com/watch?v=DBdW6wEmd7g,sexual harassment kampus indonesia
Px00m7FW1xI,Uji Publik Panitia Seleksi Satgas Pencegahan dan Penanganan Kekerasan Seksual (PPKS),Universitas Kahuripan Kediri,2024-04-04 09:05:31,Uji Publik Panitia Seleksi Satgas Pencegahan dan Penanganan Kekerasan Seksual (PPKS) Universitas Kahuripan Kediri.,118,4,1,https://www.youtube.com/watch?v=Px00m7FW1xI,PPKS perguruan tinggi
bqp4lwI3JPc,"Aman atau Tidak? Darurat Kekerasan Seksual di Kampus, Sejumlah Perguruan Tinggi Disorot | NTV",Nusantara TV,2026-04-22 14:40:00,"https://nusantaratv.com/ - Aman atau Tidak? Darurat Kekerasan Seksual di Kampus, Sejumlah Perguruan Tinggi Disorot | NTV ...",115,0,0,https://www.youtube.com/watch?v=bqp4lwI3JPc,kekerasan seksual kampus
AsrDuCfmRJk,Sosialisasi dan Edukasi Pedoman Pencegahan dan Penanggulangan Kekerasan Seksual (PPKS),FISH UNJ Official,2022-11-16 04:54:39,Sosialisasi dan Edukasi Pedoman Pencegahan dan Penanggulangan Kekerasan Seksual (PPKS) di Universitas Negeri Jakarta.,102,2,1,https://www.youtube.com/watch?v=AsrDuCfmRJk,PPKS perguruan tinggi
9KxF_ZIDZuc,Eps. 25 - SATGAS PPKS PENS : Ruang Aman Korban Kekerasan Seksual Kampus?!,Siniar PENS,2025-02-19 09:20:50,"Halohai SiniAre! Udah tau belom nih kalau di PENS ada satgas PPKS, dimana kalian bisa curhat tentang masalah yang ada ...",96,5,0,https://www.youtube.com/watch?v=9KxF_ZIDZuc,satgas PPKS kampus
CrexXZxMaS4,[Ep.54] Pencegahan dan Penanganan Kekerasan Seksual di Kampus Ft Dr.Binahayati Rusyidi,Amalia Sustikarini,2021-04-02 23:54:46,Kejadian kekerasan seksual di kampus-kampus di Indonesia menjadi hal yang sangat memprihatinkan karena terjadi di institusi ...,93,7,0,https://www.youtube.com/watch?v=CrexXZxMaS4,korban kekerasan seksual kampus
pDuLjM5DRYc,Membongkar Sisi Gelap Kampus Ternama: Mengapa Pelecehan Seksual Terus Berulang? | Inside Story,Sindo Podcast,2026-04-21 00:00:54,Selengkapnya baca di: https://nasional.sindonews.com/ https://www.youtube.com/@OfficialSINDOnews ...,92,0,0,https://www.youtube.com/watch?v=pDuLjM5DRYc,sexual harassment kampus indonesia
Btlz7I--TFs,"Mendikbud Nadiem Makarim Tegaskan Penerapan PPKS di Perguruan Tinggi, Jika Tidak akan ada Sanksi",Tribun Solo Official,2021-11-12 16:08:11,"TRIBUN-VIDEO.COM - Menteri Pendidikan, Kebudayaan, Riset, dan Teknologi (Mendikbud Ristek) Nadiem Makarim ...",90,3,0,https://www.youtube.com/watch?v=Btlz7I--TFs,PPKS perguruan tinggi
9ivzyNR5M1M,16 Mahasiswa FH UI Disidang Ramai ramai Terkait Pelecehan Seksual,Tribun Banyumas,2026-04-14 08:59:17,Sebanyak 16 mahasiswa Fakultas Hukum Universitas Indonesia menjalani sidang terbuka. Mereka diduga melakukan pelecehan ...,82,0,0,https://www.youtube.com/watch?v=9ivzyNR5M1M,sexual harassment kampus indonesia
FbUqnGKkIOU,Apa sih Satgas PPKS itu? Gimana peran mereka di lingkungan kampus? - Podcastma#3,BEM FT UNS,2023-12-16 07:28:56,"Haloo selamat datang di Podcastma BEM FT UNS, From Inferior to Superior! Di episode yang ketiga alias terakhir bangett nih.",80,9,0,https://www.youtube.com/watch?v=FbUqnGKkIOU,satgas PPKS kampus
1V9DLUts3rg,Satgas Pencegahan dan Penanganan Kekerasan Seksual (PPKS)? Kampusmu sudah punya belum?,BALI SRUTI,2023-09-19 16:14:52,Satuan Tugas Pencegahan dan Penanganan Kekerasan Seksual (Satgas PPKS) adalah satuan tugas yang memiliki fungsi untuk ...,76,1,0,https://www.youtube.com/watch?v=1V9DLUts3rg,PPKS perguruan tinggi
XChtpsfAHYg,Lawan Pelecehan Seksual di Kampus ( bagian1),KOMPASTV PALEMBANG,2021-12-09 11:32:17,"Sahabat Kompas TV Palembang, jangan lupa like, comment, dan subscribe channel YouTube Kompas TV Palembang, juga ...",75,2,0,https://www.youtube.com/watch?v=XChtpsfAHYg,korban kekerasan seksual kampus
y_F56glxQ5w,Wujudkan Kampus Bebas Kekerasan Seksual dalam Sorotan Permendikbudristek -  Video Satgas PPKS UNHAS,Satgas PPK UNHAS Official,2024-02-07 02:40:59,,75,3,0,https://www.youtube.com/watch?v=y_F56glxQ5w,satgas PPKS kampus
jv8-renT8cw,"Pelecehan Seksual Non-Verbal di Lingkungan Kampus, Psikolog : Fenomena Gunung ES",KOMPASTV BANJARMASIN,2021-10-29 12:47:20,,75,0,0,https://www.youtube.com/watch?v=jv8-renT8cw,korban kekerasan seksual kampus
Rmkgc_m3aQE,Sosialisasi Satgas PPKS Universitas Bale Bandung,fisipunibba official,2024-04-24 08:12:14,"Dalam video ini, Universitas Bale Bandung mempersembahkan upaya mereka dalam mencegah dan menangani kekerasan ...",73,0,0,https://www.youtube.com/watch?v=Rmkgc_m3aQE,satgas PPKS kampus
PPDANQMeR20,#DIKSI Eps. 39 : PPKS Garda Terdepan Berantas Kekerasan Seksual di Kampus,Laboratorium Hukum FH UMM,2024-10-18 04:35:04,"DIKSI Eps. 39 : PPKS: GARDA TERDEPAN BERANTAS KEKERASAN SEKSUAL DI KAMPUS Di episode kali ini, kami ...",70,4,0,https://www.youtube.com/watch?v=PPDANQMeR20,satgas PPKS kampus
vHvzZ-UJRyc,"KastratCast Ep.1: Edukasi, Perlindungan &amp; Aksi Kampus | Satgas PPKS UNP",BEM FPK KM UNP,2026-04-09 16:33:51,,68,29,6,https://www.youtube.com/watch?v=vHvzZ-UJRyc,satgas PPKS kampus
9M2BcspYKWo,"(15/02/2023) Webinar PPKS  &quot;Kekerasan Seksual di Kampus: Kenali, Cegah, dan Laporkan!&quot;",Satgas PPKS Universitas Mulawarman,2023-08-25 10:43:32,"Pada tanggal 15 Februari 2023, Satgas PPKS Unversitas Mulawarman telah mengadakan Webinar dan Sosialisasi PPKS ...",68,2,0,https://www.youtube.com/watch?v=9M2BcspYKWo,PPKS perguruan tinggi
7PiEmZRoIQg,Satgas PPKS Universitas Udayana Gelar Peningkatan Kapasitas Pemahaman PPKS Bagi Para Pimpinan,Udayana TV,2024-08-07 02:54:55,Satgas Pencegahan dan Penanganan Kekerasan Seksual PPKS Universitas Udayana menyelenggarakan kegiatan peningkatan ...,63,1,0,https://www.youtube.com/watch?v=7PiEmZRoIQg,PPKS perguruan tinggi
X6Zo8UXxHCY,SATGAS PPKS DI UNIVERSITAS UDAYANA,BALI SRUTI,2025-01-26 08:58:25,"Teman-teman Bali Sruti, tahukah kalian bahwa di setiap kampus ada Satgas PPKS (Satuan Tugas Pencegahan dan Penanganan ...",59,0,0,https://www.youtube.com/watch?v=X6Zo8UXxHCY,satgas PPKS kampus
